{
  "lockVersion": 1,
  "policySchemaVersion": "1.0",
  "policyEngineVersion": "1.0.7",
  "policyEngineFingerprint": "sha256:f22d8491449cd331fb543f238772ddc92095b60b22a9b05b9713a091ce284605",
  "policies": [
    {
      "department": "artificial-intelligence",
      "slug": "agent-evaluation-release-gate",
      "policyVersion": "1.0.7",
      "fingerprint": "sha256:bef8e8e2375de1c4c19d1750207e801b3cb1eb5ba5bdc2b7aeb1c92cb119fb1a"
    },
    {
      "department": "revenue-operations",
      "slug": "closed-won-launch-readiness",
      "policyVersion": "1.0.7",
      "fingerprint": "sha256:3278759b975735f0b90dcfa7bcf989256e678a88b85b3553f325a116d786d2b6"
    },
    {
      "department": "customer-success",
      "slug": "customer-health-action-review",
      "policyVersion": "1.0.7",
      "fingerprint": "sha256:27e8bbcdb786c3e60970a99f79c0598737ddd48c4820d49312f6caa3383f2c1c"
    },
    {
      "department": "data-operations",
      "slug": "enterprise-data-reconciliation-control",
      "policyVersion": "1.0.7",
      "fingerprint": "sha256:b01c83def479dfff7b3b220b8c93a5e7855662f07443506f21626f10c4e21430"
    },
    {
      "department": "field-operations",
      "slug": "field-service-completion-review",
      "policyVersion": "1.0.7",
      "fingerprint": "sha256:455936e45b08e011cdee5bafc1833c2b8de9fb9c94225605d6cbbe0820391ae2"
    },
    {
      "department": "incident-management",
      "slug": "incident-rca-evidence-review",
      "policyVersion": "1.0.7",
      "fingerprint": "sha256:66e1cc13956652247863a3d0cc7e9c8b23cb63d9be6590ddee22559837734cc8"
    },
    {
      "department": "finance",
      "slug": "invoice-exception-triage",
      "policyVersion": "1.0.7",
      "fingerprint": "sha256:c95b79f0c52df43dc91bbdc873fd5f6b5146e6b0b552c7a3f10a99913eb26924"
    },
    {
      "department": "operations",
      "slug": "meeting-to-action-review",
      "policyVersion": "1.0.7",
      "fingerprint": "sha256:57b73a5472c6f6dc40523585f243a5abf232026008af4c250e343a055ce2b5ff"
    },
    {
      "department": "artificial-intelligence",
      "slug": "multi-model-routing-fallback",
      "policyVersion": "1.0.7",
      "fingerprint": "sha256:66c1e1fed19b345f7126800e0c677de1d2810dee8bae801a79b2b5f3fe37f97f"
    },
    {
      "department": "people-operations",
      "slug": "people-operations-case-routing",
      "policyVersion": "1.0.7",
      "fingerprint": "sha256:753aa1d11fff493c04b6a27576b39d0a9e45b13687914413607f63bff40d4529"
    },
    {
      "department": "security",
      "slug": "phishing-report-triage",
      "policyVersion": "1.0.7",
      "fingerprint": "sha256:c36f120415e4101a9271a7afaeda25a0628623c77882c5191702f32eb294e31a"
    },
    {
      "department": "engineering",
      "slug": "production-change-risk-gate",
      "policyVersion": "1.0.7",
      "fingerprint": "sha256:65f29d5935c2ae68f66ba1674540e9acfc222b026fe851d7d90a00be0de2c1b0"
    },
    {
      "department": "sales",
      "slug": "research-to-crm-review",
      "policyVersion": "1.0.7",
      "fingerprint": "sha256:8b0f38356de100a46894ad350c465a403699cac6d99b6b87133d03e1b8bb9058"
    },
    {
      "department": "proposal-management",
      "slug": "rfp-response-evidence-review",
      "policyVersion": "1.0.7",
      "fingerprint": "sha256:b456da142738ed2d32c9314990f55c51ffbc95771999290d3842eb00a5e6604d"
    },
    {
      "department": "information-technology",
      "slug": "service-desk-priority-routing",
      "policyVersion": "1.0.7",
      "fingerprint": "sha256:d4bef95afeacecf153a6017b64b1f1d71880dfc76098d15764c6b50ed9e2209b"
    },
    {
      "department": "customer-support",
      "slug": "support-escalation-command-center",
      "policyVersion": "1.0.8",
      "fingerprint": "sha256:9194c7db9751b10a971234bf20160a011c0fadd84c3e1a85ed603d5e4c895b64"
    }
  ]
}
